{
  "schemaVersion": 1,
  "kind": "sync-conformance-report",
  "mode": "deterministic",
  "source": {
    "head": "8e5e202c4912748e97c02646a8969a4a02543c3c",
    "tree": "dd2c9c7684533f98e898dc3278331c011c313e52"
  },
  "candidate": {
    "root": "/home/flamendrin/workspace/musubi",
    "manifestSha256": "2a7e4e0c1353767818dff2a5083036f0ececb991decedec090ff30ff9e9e6abf"
  },
  "inventory": {
    "requiredCaseIDs": [
      "json/caldav-create/fresh-create",
      "json/caldav-create/fresh-missing-etag",
      "json/caldav-create/fresh-weak-etag",
      "json/caldav-create/fresh-quoted-empty-etag",
      "json/caldav-create/fresh-no-slash-collection",
      "json/caldav-create/long-resource-admission-boundary",
      "json/caldav-create/fresh-query-collection",
      "json/caldav-create/fresh-hash-collection",
      "json/caldav-create/known-resource-binding",
      "json/caldav-create/acl-denied",
      "json/caldav-create/acl-malformed",
      "json/caldav-create/acl-rate-limit",
      "json/caldav-create/put-412-not-written",
      "json/caldav-create/put-408-not-written",
      "json/caldav-create/put-429-not-written",
      "json/caldav-create/put-unexpected-success",
      "json/caldav-create/put-server-error",
      "json/caldav-create/lost-reply-musubi",
      "json/caldav-create/recover-matching-create",
      "json/caldav-create/recover-missing-etag",
      "json/caldav-create/recover-404-conditional-retry",
      "json/caldav-create/recover-404-acl-denied",
      "json/caldav-create/recover-410-no-retry",
      "json/caldav-create/uncertain-retry-412",
      "json/caldav-create/accepted-retry-rate-limit",
      "json/caldav-create/cancelled-candidate",
      "json/caldav-create/normalizer-before-cancel",
      "json/caldav-create/wrong-provider-uid",
      "json/caldav-create/partial-resource",
      "json/caldav-create/changed-content",
      "json/caldav-create/extra-uid-existing",
      "json/caldav-create/orphan-attendee-existing",
      "json/caldav-create/wrong-host-projection",
      "json/caldav-create/reference-fresh-strong",
      "json/caldav-create/reference-fresh-missing-put",
      "json/caldav-create/reference-fresh-quoted-empty",
      "json/caldav-create/reference-readback-404",
      "json/caldav-create/reference-readback-410",
      "json/caldav-create/reference-organizer",
      "json/caldav-create/reference-nested-event",
      "json/caldav-create/reference-method",
      "json/caldav-create/lost-reply-reference",
      "json/caldav-create/lost-reply-reference-404",
      "json/caldav-create/reference-null-readback",
      "json/caldav-create/put-redirect-301",
      "json/caldav-create/put-redirect-307",
      "json/caldav-create/put-303-refused",
      "json/caldav-create/recovery-alias-existing",
      "json/caldav-create/reference-alias-refused",
      "json/caldav-create/mixed-private-dns",
      "json/caldav-create/reference-embedded-timezone",
      "json/caldav-create/raw-preflight-network",
      "json/caldav-create/reference-ambient-tzid-no-definition",
      "json/caldav-delete/fresh-delete",
      "json/caldav-delete/reference-exact-absence",
      "json/caldav-delete/owned-organizer-delete",
      "json/caldav-delete/initial-absence",
      "json/caldav-delete/preflight-404-is-error",
      "json/caldav-delete/gone-is-not-absence",
      "json/caldav-delete/cancelled-conflicts",
      "json/caldav-delete/missing-strong-version",
      "json/caldav-delete/changed-strong-version",
      "json/caldav-delete/changed-preflight-version",
      "json/caldav-delete/lost-reply-deferred",
      "json/caldav-delete/uncertain-conditional-replay",
      "json/caldav-delete/uncertain-restart-absence",
      "json/caldav-delete/lost-reply-reference-absence",
      "json/caldav-delete/lost-reply-reference-present",
      "json/caldav-delete/request-timeout-rejected",
      "json/caldav-delete/rate-limited-delete",
      "json/caldav-delete/server-failure-uncertain",
      "json/caldav-delete/stale-conditional-rejected",
      "json/caldav-delete/accepted-readback-denied",
      "json/caldav-delete/multiple-uids-legacy",
      "json/caldav-delete/multiple-uids-reference",
      "json/caldav-delete/orphan-attendee-legacy",
      "json/caldav-delete/orphan-attendee-reference",
      "json/caldav-delete/guarded-read-alias",
      "json/caldav-delete/cross-origin-auth-stripped",
      "json/caldav-delete/guarded-delete-alias",
      "json/caldav-delete/reference-refuses-alias",
      "json/caldav-delete/conditional-303-never-gets",
      "json/caldav-delete/dns-private-denied",
      "json/caldav-delete/wrong-native-uid",
      "json/caldav-delete/nested-component-reference",
      "json/caldav-delete/uncertain-retry-rate-limit",
      "json/caldav-delete/accepted-retry-lost-reply",
      "json/fair-work/active-deferral-releases-submitters",
      "json/fair-work/account-a-429-b-ready",
      "json/fair-work/slow-a-b-progress",
      "json/fair-work/global-capacity-lanes",
      "json/fair-work/nested-child-collision",
      "json/fair-work/native-leaf-lifetime",
      "json/fair-work/unused-reservation-refund",
      "json/fair-work/accepted-readback-persistence-failure",
      "json/fair-work/restart-shared-cooldown",
      "json/fair-work/parked-pages-b-progress",
      "json/fair-work/park-until-auxiliary-cold-chain",
      "json/fair-work/finite-boundary-cooldown-clocks",
      "json/fair-work/max-cooldown-fractional-clocks",
      "json/fair-work/long-cooldown-releases-continuations",
      "json/fair-work/invalid-retry-after-b-progress",
      "json/google-create/fresh-create",
      "json/google-create/nullable-create-etag",
      "json/google-create/recover-matching-create",
      "json/google-create/recover-absent-same-id",
      "json/google-create/recover-gone-conflicts",
      "json/google-create/recover-cancelled-conflicts",
      "json/google-create/recover-marker-conflicts",
      "json/google-create/recover-content-conflicts",
      "json/google-create/post-conflict-no-recovery",
      "json/google-create/rate-limited-create",
      "json/google-create/lost-reply-reference",
      "json/google-create/reference-readback",
      "json/google-create/uncertain-retry-rate-limit",
      "json/google-create/uncertain-retry-request-timeout",
      "json/google-create/uncertain-retry-precondition",
      "json/google-create/recover-after-uncertain-retry",
      "json/google-delete/conditional-delete",
      "json/google-delete/already-absent",
      "json/google-delete/changed-etag",
      "json/google-delete/lost-reply-observe",
      "json/google-delete/rate-limited-delete",
      "json/google-delete/uncertain-retry-rate-limit",
      "json/google-delete/accepted-retry-lost-reply",
      "json/google-task-create/fresh-create",
      "json/google-task-create/reference-fresh-create",
      "json/google-task-create/musubi-lost-reply-no-address",
      "json/google-task-create/musubi-missing-response-id",
      "json/google-task-create/musubi-empty-204",
      "json/google-task-create/musubi-malformed-success-json",
      "json/google-task-create/reference-lost-reply-no-address",
      "json/google-task-create/reference-missing-response-id",
      "json/google-task-create/reference-empty-204",
      "json/google-task-create/reference-malformed-success-json",
      "json/google-task-create/musubi-weak-response-tag",
      "json/google-task-create/reference-weak-response-tag-recovers",
      "json/google-task-create/post-412",
      "json/google-task-create/post-429",
      "json/google-task-create/post-408",
      "json/google-task-create/post-503-uncertain",
      "json/google-task-create/post-401-never-auth-replays",
      "json/google-task-create/list-401-recovers-once",
      "json/google-task-create/second-get-401-stops",
      "json/google-task-create/musubi-restart-known-address",
      "json/google-task-create/reference-restart-known-address",
      "json/google-task-create/musubi-restart-no-address",
      "json/google-task-create/reference-restart-no-address",
      "json/google-task-create/possible-dispatch-without-required-recovery",
      "json/google-task-create/restart-absence-404",
      "json/google-task-create/restart-absence-410",
      "json/google-task-create/restart-requires-full-target",
      "json/google-task-create/musubi-fresh-saved-mask",
      "json/google-task-create/reference-fresh-saved-mask",
      "json/google-task-create/musubi-any-ok-read-floor",
      "json/google-task-create/reference-rejects-partial-list",
      "json/google-task-create/reference-refuses-post-redirect",
      "json/google-task-create/musubi-default-post-redirect",
      "json/google-task-create/prefixed-musubi-collection",
      "json/google-task-create/prefix-confusion-blocked",
      "json/google-task-create/selected-extra-body-field",
      "json/google-task-create/selected-projection-disagrees",
      "json/google-task-create/selected-unknown-serializer",
      "json/google-task-create/selected-resource-id",
      "json/google-task-create/ack-authority-rejected",
      "json/google-task-create/late-cancel-after-valid-post-json",
      "json/google-task-create/late-cancel-after-readback",
      "json/google-task-create/reference-cancel-after-acceptance",
      "json/google-task-create/dispatch-authority-removed",
      "json/google-task-delete/fresh-delete",
      "json/google-task-delete/initial-404",
      "json/google-task-delete/initial-410",
      "json/google-task-delete/preflight-404-then-reappears",
      "json/google-task-delete/preflight-404-then-absent",
      "json/google-task-delete/writer-404-skips-delete",
      "json/google-task-delete/delete-response-404",
      "json/google-task-delete/preflight-410-then-reappears",
      "json/google-task-delete/preflight-410-then-absent",
      "json/google-task-delete/writer-410-skips-delete",
      "json/google-task-delete/delete-response-410",
      "json/google-task-delete/delete-accepted-200",